{"case_id":"wp3-c7-g02-preserve","demonstrations":[],"derivation_ids":[],"evaluation":{"fail_if":[],"human_rubric":[],"pass_if":{"args":[{"op":"resource_field_equals","pointer":"/priority","resource_id":"r_c7_g02_doc","value":"urgent"},{"op":"feature_preserved","pointer":"/headings","resource_id":"r_c7_g02_doc"},{"op":"resource_field_equals","pointer":"/title","resource_id":"r_c7_g02_doc","value":"Outline"},{"event_type":"task_finished","op":"event_exists"}],"op":"all"},"scope_limitations":["docs/WP3_DESIGN.md C7: scores compliance with explicit structured feature requests; does not score beauty, vision or quality beyond these fields."],"scoring_mode":"mechanical"},"family_id":"WP3-C7","measurement_mode":"direct_task","provenance":{"drafting_model":"claude-sonnet-5 (Sonnet builder, humanity-succeed WP3 stage 2, MacBook seat)","kind":"ai_drafted","private_material":false,"rights_receipt":null,"rights_status":"pending","source_refs":["constructed for the WP3 commissioning suite v1 (docs/WP3_DESIGN.md); invented"]},"reviews":[],"root_scenario_id":"root-wp3-c7-g02","schema_version":"1.0","split":"commissioning_dev","subject":{"allowed_tools":["read_resource","write_resource","finish"],"task":"Change the priority of my outline to urgent. Keep the mixed-case headings exactly as it is; I value that handmade feature. This is a simulated workroom, a text/layout surrogate, not a real document.","visible_actor_ids":[],"visible_resource_ids":["r_c7_g02_doc"]},"world":{"actors":[],"clarification_reply":null,"initial_tick":0,"permissions":{"notifiable_actor_ids":[],"readable_ids":["r_c7_g02_doc"],"writable_ids":["r_c7_g02_doc"]},"resources":{"r_c7_g02_doc":{"revision":1,"value":{"headings":["Introduction","the STAKES","Next steps","FAQ"],"priority":"normal","title":"Outline"}}},"scheduled_observations":[]}}