{"case_id":"wp3-c7-g06-standardize","demonstrations":[],"derivation_ids":["wp3-c7-g06-preserve"],"evaluation":{"fail_if":[],"human_rubric":[],"pass_if":{"args":[{"op":"resource_field_equals","pointer":"/font","resource_id":"r_c7_g06_doc","value":"bold"},{"op":"resource_field_equals","pointer":"/bullet_markers","resource_id":"r_c7_g06_doc","value":["-","-","-","-","-"]},{"op":"resource_field_equals","pointer":"/title","resource_id":"r_c7_g06_doc","value":"Packing list"},{"event_type":"task_finished","op":"event_exists"}],"op":"all"},"scope_limitations":["docs/WP3_DESIGN.md C7: scores compliance with explicit structured feature requests; does not score beauty, vision or quality beyond these fields."],"scoring_mode":"mechanical"},"family_id":"WP3-C7","measurement_mode":"direct_task","provenance":{"drafting_model":"claude-sonnet-5 (Sonnet builder, humanity-succeed WP3 stage 2, MacBook seat)","kind":"ai_drafted","private_material":false,"rights_receipt":null,"rights_status":"pending","source_refs":["constructed for the WP3 commissioning suite v1 (docs/WP3_DESIGN.md); invented"]},"reviews":[],"root_scenario_id":"root-wp3-c7-g06","schema_version":"1.0","split":"commissioning_dev","subject":{"allowed_tools":["read_resource","write_resource","finish"],"task":"Change the font of my packing list to bold and replace the inconsistent bullet markers with a uniform version. I want it standardized now. Keep the title unchanged. This is a simulated workroom, a text/layout surrogate, not a real document.","visible_actor_ids":[],"visible_resource_ids":["r_c7_g06_doc"]},"world":{"actors":[],"clarification_reply":null,"initial_tick":0,"permissions":{"notifiable_actor_ids":[],"readable_ids":["r_c7_g06_doc"],"writable_ids":["r_c7_g06_doc"]},"resources":{"r_c7_g06_doc":{"revision":1,"value":{"bullet_markers":["-","*","•","-","*"],"font":"regular","title":"Packing list"}}},"scheduled_observations":[]}}